{
  "characterId": "harpy",
  "name": "Harpy the Sky Terror",
  "archetype": "Rushdown",
  "stats": {
    "maxHealth": 920,
    "walkSpeed": 240,
    "dashSpeed": 440,
    "jumpVelocity": -620,
    "gravity": 1100
  },
  "moves": [
    {
      "id": "light_talon",
      "name": "Talon Jab (5A)",
      "type": "normal",
      "inputSequence": ["F"],
      "startupFrames": 5,
      "activeFrames": 3,
      "recoveryFrames": 8,
      "blockAdvantage": 3,
      "hitAdvantage": 7,
      "damage": 40,
      "hitbox": { "offsetX": 55, "offsetY": -20, "width": 45, "height": 25, "knockbackX": 60, "knockbackY": 0 }
    },
    {
      "id": "wing_flurry",
      "name": "Wing Flurry (5B)",
      "type": "normal",
      "inputSequence": ["G"],
      "startupFrames": 8,
      "activeFrames": 4,
      "recoveryFrames": 12,
      "blockAdvantage": 0,
      "hitAdvantage": 5,
      "damage": 75,
      "hitbox": { "offsetX": 65, "offsetY": -30, "width": 60, "height": 35, "knockbackX": 160, "knockbackY": -50 }
    },
    {
      "id": "wing_blade",
      "name": "Wing Blade (6B)",
      "type": "command_normal",
      "inputSequence": ["D", "G"],
      "startupFrames": 9,
      "activeFrames": 4,
      "recoveryFrames": 14,
      "blockAdvantage": -2,
      "hitAdvantage": 6,
      "damage": 90,
      "hitbox": { "offsetX": 70, "offsetY": -25, "width": 70, "height": 35, "knockbackX": 200, "knockbackY": -60 }
    },
    {
      "id": "gale_talon",
      "name": "Gale Strike (5C)",
      "type": "normal",
      "inputSequence": ["H"],
      "startupFrames": 11,
      "activeFrames": 5,
      "recoveryFrames": 17,
      "blockAdvantage": -3,
      "hitAdvantage": 8,
      "damage": 120,
      "hitbox": { "offsetX": 75, "offsetY": -15, "width": 80, "height": 40, "knockbackX": 260, "knockbackY": -120 }
    },
    {
      "id": "air_light",
      "name": "Air Talon Strike (8A)",
      "type": "normal",
      "inputSequence": ["JUMP", "F"],
      "startupFrames": 4,
      "activeFrames": 4,
      "recoveryFrames": 7,
      "blockAdvantage": 4,
      "hitAdvantage": 8,
      "damage": 45,
      "hitbox": { "offsetX": 50, "offsetY": 10, "width": 50, "height": 30, "knockbackX": 70, "knockbackY": 40 }
    },
    {
      "id": "air_heavy",
      "name": "Air Wing Cleave (8C)",
      "type": "normal",
      "inputSequence": ["JUMP", "H"],
      "startupFrames": 8,
      "activeFrames": 5,
      "recoveryFrames": 12,
      "blockAdvantage": 1,
      "hitAdvantage": 9,
      "damage": 110,
      "hitbox": { "offsetX": 65, "offsetY": 15, "width": 75, "height": 45, "knockbackX": 220, "knockbackY": 90 }
    },
    {
      "id": "tempest_dive",
      "name": "Tempest Cyclone (235B)",
      "type": "special",
      "inputSequence": ["R"],
      "startupFrames": 10,
      "activeFrames": 6,
      "recoveryFrames": 16,
      "blockAdvantage": -4,
      "hitAdvantage": 11,
      "damage": 140,
      "hitbox": { "offsetX": 85, "offsetY": -20, "width": 85, "height": 50, "knockbackX": 300, "knockbackY": -150 }
    },
    {
      "id": "sky_uppercut",
      "name": "Rising Sky Dragon (262C)",
      "type": "special",
      "inputSequence": ["W", "H"],
      "startupFrames": 7,
      "activeFrames": 8,
      "recoveryFrames": 22,
      "blockAdvantage": -12,
      "hitAdvantage": 14,
      "damage": 165,
      "hitbox": { "offsetX": 60, "offsetY": -60, "width": 70, "height": 90, "knockbackX": 180, "knockbackY": -320 }
    },
    {
      "id": "feather_storm",
      "name": "Tempest Feather Storm (Super)",
      "type": "super",
      "inputSequence": ["S", "D", "H"],
      "startupFrames": 12,
      "activeFrames": 10,
      "recoveryFrames": 20,
      "blockAdvantage": -6,
      "hitAdvantage": 15,
      "damage": 230,
      "hitbox": { "offsetX": 90, "offsetY": -40, "width": 110, "height": 70, "knockbackX": 380, "knockbackY": -220 }
    }
  ]
}
