{
  "characterId": "kharon",
  "name": "Kharon the Pyromancer",
  "archetype": "Rushdown",
  "stats": {
    "maxHealth": 1000,
    "walkSpeed": 200,
    "dashSpeed": 350,
    "jumpVelocity": -540,
    "gravity": 1200
  },
  "moves": [
    {
      "id": "light_jab",
      "name": "Flame Jab",
      "type": "normal",
      "inputSequence": ["F"],
      "startupFrames": 6,
      "activeFrames": 3,
      "recoveryFrames": 10,
      "blockAdvantage": 2,
      "hitAdvantage": 5,
      "damage": 45,
      "hitbox": { "offsetX": 45, "offsetY": -20, "width": 35, "height": 20, "knockbackX": 80, "knockbackY": 0 }
    },
    {
      "id": "heavy_slash",
      "name": "Cinder Blade",
      "type": "normal",
      "inputSequence": ["G"],
      "startupFrames": 12,
      "activeFrames": 4,
      "recoveryFrames": 18,
      "blockAdvantage": -4,
      "hitAdvantage": 2,
      "damage": 110,
      "hitbox": { "offsetX": 60, "offsetY": -25, "width": 55, "height": 30, "knockbackX": 220, "knockbackY": -80 }
    },
    {
      "id": "crouch_sweep",
      "name": "Magma Sweep",
      "type": "command_normal",
      "inputSequence": ["S", "F"],
      "startupFrames": 9,
      "activeFrames": 4,
      "recoveryFrames": 15,
      "blockAdvantage": -7,
      "hitAdvantage": 14,
      "damage": 85,
      "hitbox": { "offsetX": 50, "offsetY": 30, "width": 60, "height": 20, "knockbackX": 150, "knockbackY": -200 }
    },
    {
      "id": "special_hellfire",
      "name": "Hellfire Surge",
      "type": "special",
      "inputSequence": ["S", "D", "H"],
      "startupFrames": 14,
      "activeFrames": 8,
      "recoveryFrames": 22,
      "blockAdvantage": -9,
      "hitAdvantage": 8,
      "damage": 180,
      "hitbox": { "offsetX": 70, "offsetY": -10, "width": 80, "height": 45, "knockbackX": 350, "knockbackY": -160 }
    }
  ]
}
